{
  "schema": "ai-edge-tlm/source-register/v1",
  "as_of_date": "2026-08-21",
  "foundation_subject": "e959201574b9548758e9d173b02e214c9e8531e7",
  "max_rolling_age_days": 120,
  "sources": [
    {
      "id": "SRC-USER-ARTICLE-PACKET",
      "kind": "USER_SUPPLIED_NARRATIVE",
      "title": "N-EDGE architecture card collection supplied in issue context",
      "url": "UNAVAILABLE",
      "revision": "UNAVAILABLE",
      "retrieved_at": "2026-08-21",
      "identity_state": "SOURCE_PACKET_REQUIRED",
      "primary": false,
      "license_plane": "UNKNOWN",
      "notes": "Card text is retained by claim ID, but the original article/video/PDF URL and immutable bytes were not supplied."
    },
    {
      "id": "SRC-LITERT-LM-REPO",
      "kind": "GIT_REPOSITORY",
      "title": "google-ai-edge/LiteRT-LM",
      "url": "https://github.com/google-ai-edge/LiteRT-LM/tree/d92aaa8624cf22fbd0e56ad90fce9c190c7cb096",
      "revision": "d92aaa8624cf22fbd0e56ad90fce9c190c7cb096",
      "retrieved_at": "2026-08-21",
      "identity_state": "IMMUTABLE",
      "primary": true,
      "license_plane": "SOURCE_CODE",
      "notes": "Current main revision at retrieval time; stable adoption must pin a release rather than floating main."
    },
    {
      "id": "SRC-LITERT-LM-README",
      "kind": "GIT_FILE",
      "title": "LiteRT-LM README at pinned revision",
      "url": "https://github.com/google-ai-edge/LiteRT-LM/blob/d92aaa8624cf22fbd0e56ad90fce9c190c7cb096/README.md",
      "revision": "d92aaa8624cf22fbd0e56ad90fce9c190c7cb096",
      "retrieved_at": "2026-08-21",
      "identity_state": "IMMUTABLE",
      "primary": true,
      "license_plane": "DOCUMENTATION",
      "notes": "Declares v0.16.0, Kotlin stable, Swift early preview, cross-platform runtime, tool use and .litertlm CLI examples."
    },
    {
      "id": "SRC-LITERT-REPO",
      "kind": "GIT_REPOSITORY",
      "title": "google-ai-edge/LiteRT",
      "url": "https://github.com/google-ai-edge/LiteRT/tree/86c3b631320559df02ed4f15b19f16f8a2872750",
      "revision": "86c3b631320559df02ed4f15b19f16f8a2872750",
      "retrieved_at": "2026-08-21",
      "identity_state": "IMMUTABLE",
      "primary": true,
      "license_plane": "SOURCE_CODE",
      "notes": "Runtime substrate; accelerator support remains device/delegate specific."
    },
    {
      "id": "SRC-LITERT-TORCH-REPO",
      "kind": "GIT_REPOSITORY",
      "title": "google-ai-edge/litert-torch",
      "url": "https://github.com/google-ai-edge/litert-torch/tree/8379afb7d0acb1e6f758004b09e6d24c62d4b761",
      "revision": "8379afb7d0acb1e6f758004b09e6d24c62d4b761",
      "retrieved_at": "2026-08-21",
      "identity_state": "IMMUTABLE",
      "primary": true,
      "license_plane": "SOURCE_CODE",
      "notes": "Model conversion/export tooling; exact operator and model support must be tested at the selected release."
    },
    {
      "id": "SRC-GALLERY-REPO",
      "kind": "GIT_REPOSITORY",
      "title": "google-ai-edge/gallery",
      "url": "https://github.com/google-ai-edge/gallery/tree/ec7fee19e3b7aad9991105e549d544233ea0b97f",
      "revision": "ec7fee19e3b7aad9991105e549d544233ea0b97f",
      "retrieved_at": "2026-08-21",
      "identity_state": "IMMUTABLE",
      "primary": true,
      "license_plane": "SOURCE_CODE",
      "notes": "Reference app and model/skill ecosystem, not a production security proof for downstream hosts."
    },
    {
      "id": "SRC-GALLERY-SKILLS",
      "kind": "GIT_FILE",
      "title": "AI Edge Gallery Agent Skills guide",
      "url": "https://github.com/google-ai-edge/gallery/blob/ec7fee19e3b7aad9991105e549d544233ea0b97f/skills/README.md",
      "revision": "ec7fee19e3b7aad9991105e549d544233ea0b97f",
      "retrieved_at": "2026-08-21",
      "identity_state": "IMMUTABLE",
      "primary": true,
      "license_plane": "DOCUMENTATION",
      "notes": "Corroborates metadata-first SKILL.md discovery, hidden WebView JS, native intents, URL/local loading and out-of-band secret input."
    },
    {
      "id": "SRC-MEDIAPIPE-REPO",
      "kind": "GIT_REPOSITORY",
      "title": "google-ai-edge/mediapipe",
      "url": "https://github.com/google-ai-edge/mediapipe/tree/ec9e939e321549594fdbc6328dbb9af3142def5d",
      "revision": "ec9e939e321549594fdbc6328dbb9af3142def5d",
      "retrieved_at": "2026-08-21",
      "identity_state": "IMMUTABLE",
      "primary": true,
      "license_plane": "SOURCE_CODE",
      "notes": "Legacy/current MediaPipe responsibilities must be evaluated per API; no blanket .task retirement is inferred."
    },
    {
      "id": "SRC-MLKIT-GENAI-OVERVIEW",
      "kind": "ROLLING_OFFICIAL_DOC",
      "title": "ML Kit GenAI APIs overview",
      "url": "https://developers.google.com/ml-kit/genai",
      "revision": "LAST_UPDATED_2026-08-07",
      "retrieved_at": "2026-08-21",
      "identity_state": "ROLLING",
      "primary": true,
      "license_plane": "SDK_SERVICE",
      "notes": "On-device/AICore benefits, device allowlists, per-app quotas, foreground-only use, model-version variability and runtime availability checks."
    },
    {
      "id": "SRC-MLKIT-PROMPT-API",
      "kind": "ROLLING_OFFICIAL_DOC",
      "title": "ML Kit GenAI Prompt API for Android",
      "url": "https://developers.google.com/ml-kit/genai/prompt/android",
      "revision": "LAST_UPDATED_2026-07-15",
      "retrieved_at": "2026-08-21",
      "identity_state": "ROLLING",
      "primary": true,
      "license_plane": "SDK_SERVICE",
      "notes": "Beta API, custom text/multimodal prompts and structured output; no SLA or deprecation guarantee."
    },
    {
      "id": "SRC-APPLE-FOUNDATION-MODELS",
      "kind": "ROLLING_OFFICIAL_DOC",
      "title": "Apple Foundation Models framework",
      "url": "https://developer.apple.com/documentation/foundationmodels/",
      "revision": "ROLLING_2026-08-21",
      "retrieved_at": "2026-08-21",
      "identity_state": "ROLLING",
      "primary": true,
      "license_plane": "SDK_STORE",
      "notes": "Sessions, guided generation, tools, availability checks and prompt-version management; parts of the API are beta."
    },
    {
      "id": "SRC-APPLE-LANGUAGE-MODEL-SESSION",
      "kind": "ROLLING_OFFICIAL_DOC",
      "title": "Apple LanguageModelSession",
      "url": "https://developer.apple.com/documentation/FoundationModels/LanguageModelSession",
      "revision": "ROLLING_2026-08-21",
      "retrieved_at": "2026-08-21",
      "identity_state": "ROLLING",
      "primary": true,
      "license_plane": "SDK_STORE",
      "notes": "Stateful transcript, prewarm, structured responses, tools and context-size errors; API documentation labels preliminary/beta surfaces."
    },
    {
      "id": "SRC-FUNCTIONGEMMA-MODEL-CARD",
      "kind": "ROLLING_OFFICIAL_MODEL_CARD",
      "title": "FunctionGemma model card",
      "url": "https://ai.google.dev/gemma/docs/functiongemma/model_card",
      "revision": "RETRIEVED_2026-08-21",
      "retrieved_at": "2026-08-21",
      "identity_state": "ROLLING",
      "primary": true,
      "license_plane": "MODEL_WEIGHTS",
      "notes": "270M function-calling base; current official Mobile Actions example reports 58% base, 85% fine-tuned and S25 Ultra CPU performance."
    },
    {
      "id": "SRC-FUNCTIONGEMMA-FINETUNING",
      "kind": "ROLLING_OFFICIAL_DOC",
      "title": "Fine-tuning with FunctionGemma",
      "url": "https://ai.google.dev/gemma/docs/functiongemma/finetuning-with-functiongemma",
      "revision": "RETRIEVED_2026-08-21",
      "retrieved_at": "2026-08-21",
      "identity_state": "ROLLING",
      "primary": true,
      "license_plane": "MODEL_WEIGHTS",
      "notes": "Corroborates task-specific SFT and synthetic examples; explicitly requires Gemma terms acceptance and a model-access token."
    },
    {
      "id": "SRC-GEMMA-TERMS",
      "kind": "ROLLING_LEGAL_TERMS",
      "title": "Gemma Terms of Use",
      "url": "https://ai.google.dev/gemma/terms",
      "revision": "LAST_MODIFIED_2026-04-01",
      "retrieved_at": "2026-08-21",
      "identity_state": "ROLLING",
      "primary": true,
      "license_plane": "MODEL_WEIGHTS",
      "notes": "Separate from Apache-2.0 runtime source code. Acceptance and commercial/legal applicability are Human-owned."
    },
    {
      "id": "SRC-FASTVLM-REPO",
      "kind": "GIT_REPOSITORY",
      "title": "apple/ml-fastvlm",
      "url": "https://github.com/apple/ml-fastvlm/tree/592b4add3c1c8a518e77d95dc6248e76c1dd591f",
      "revision": "592b4add3c1c8a518e77d95dc6248e76c1dd591f",
      "retrieved_at": "2026-08-21",
      "identity_state": "IMMUTABLE",
      "primary": true,
      "license_plane": "SOURCE_CODE",
      "notes": "Official FastVLM implementation; code and model-weight licenses are separate."
    },
    {
      "id": "SRC-FASTVLM-MODEL-LICENSE",
      "kind": "GIT_FILE",
      "title": "FastVLM model license",
      "url": "https://github.com/apple/ml-fastvlm/blob/592b4add3c1c8a518e77d95dc6248e76c1dd591f/LICENSE_MODEL",
      "revision": "592b4add3c1c8a518e77d95dc6248e76c1dd591f",
      "retrieved_at": "2026-08-21",
      "identity_state": "IMMUTABLE",
      "primary": true,
      "license_plane": "MODEL_WEIGHTS",
      "notes": "Research-only; explicitly excludes commercial exploitation, product development and commercial products/services."
    },
    {
      "id": "SRC-ELOQUENT-APPSTORE",
      "kind": "ROLLING_OFFICIAL_STORE_LISTING",
      "title": "Google AI Edge Eloquent App Store listing",
      "url": "https://apps.apple.com/us/app/google-ai-edge-eloquent/id6756505519",
      "revision": "RETRIEVED_2026-08-21",
      "retrieved_at": "2026-08-21",
      "identity_state": "ROLLING",
      "primary": true,
      "license_plane": "SDK_STORE",
      "notes": "Corroborates Gemma-based on-device dictation, text polish and personal dictionary; listing also says some optional advanced features require cloud."
    }
  ]
}
